{
  "log_uuid": "18a53f71-1f38-4d32-aa4f-10445b8ec377",
  "ingestion_timestamp": "2026-05-08T09:52:19.902979+00:00",
  "event_timestamp": "2026-05-08T09:52:19.902979+00:00",
  "event_type": "DNS_QUERY",
  "hostname": "WORKSTATION19",
  "sha256_hash": "88cea4c44a5a5705facca0d62b550a66ce73107625e0b5b7a1a3fcc04ed42e5c",
  "raw_payload": "Baseline log 24",
  "synthetic_intent": "WORKSTATION19 (unknown) queried DNS for unknown.",
  "source_ip": null,
  "dest_ip": null,
  "source_port": null,
  "dest_port": null,
  "process_name": null,
  "parent_process_name": null,
  "user_account": "jsmith",
  "event_code": null,
  "file_path": null,
  "registry_key": null,
  "command_line_args": null,
  "dns_query": null,
  "http_url": null,
  "http_method": null,
  "bytes_sent": null,
  "bytes_received": null,
  "mitre_technique_hint": null
}