{
  "log_uuid": "16475da4-8fbd-4008-a449-d38b7b765914",
  "ingestion_timestamp": "2026-05-08T09:54:26.805430+00:00",
  "event_timestamp": "2026-05-08T09:54:26.805430+00:00",
  "event_type": "DNS_QUERY",
  "hostname": "WORKSTATION15",
  "sha256_hash": "7e3789531562d39f537b1bdea052feca7987d004a6574ebc116974b8293002ca",
  "raw_payload": "Baseline log 86",
  "synthetic_intent": "WORKSTATION15 (unknown) queried DNS for unknown.",
  "source_ip": null,
  "dest_ip": null,
  "source_port": null,
  "dest_port": null,
  "process_name": null,
  "parent_process_name": null,
  "user_account": "bwayne",
  "event_code": null,
  "file_path": null,
  "registry_key": null,
  "command_line_args": null,
  "dns_query": null,
  "http_url": null,
  "http_method": null,
  "bytes_sent": null,
  "bytes_received": null,
  "mitre_technique_hint": null
}