{
  "log_uuid": "3cdac503-6999-40b2-99f4-6befd1ce42d3",
  "ingestion_timestamp": "2026-05-08T09:53:58.105722+00:00",
  "event_timestamp": "2026-05-08T09:53:58.105722+00:00",
  "event_type": "NETWORK_CONNECTION",
  "hostname": "WORKSTATION13",
  "sha256_hash": "1319d39a104085a582de03a442ab6da721dd8875be5408c6bbbba83e5c6dc1c0",
  "raw_payload": "Baseline log 72",
  "synthetic_intent": "unknown on WORKSTATION13 initiated a network connection from unknown:unknown to unknown:unknown.",
  "source_ip": null,
  "dest_ip": null,
  "source_port": null,
  "dest_port": null,
  "process_name": null,
  "parent_process_name": null,
  "user_account": "ckent",
  "event_code": null,
  "file_path": null,
  "registry_key": null,
  "command_line_args": null,
  "dns_query": null,
  "http_url": null,
  "http_method": null,
  "bytes_sent": null,
  "bytes_received": null,
  "mitre_technique_hint": null
}