{
  "log_uuid": "24d35eed-16ce-45d2-ba9b-69307a36c7d7",
  "ingestion_timestamp": "2026-05-08T09:53:21.278406+00:00",
  "event_timestamp": "2026-05-08T09:53:21.278406+00:00",
  "event_type": "DNS_QUERY",
  "hostname": "WORKSTATION18",
  "sha256_hash": "9600b88dcb33c234fce07d03f95d6a737b29aff5bd6a35dd09b05e6b56a31b42",
  "raw_payload": "Baseline log 54",
  "synthetic_intent": "WORKSTATION18 (unknown) queried DNS for unknown.",
  "source_ip": null,
  "dest_ip": null,
  "source_port": null,
  "dest_port": null,
  "process_name": null,
  "parent_process_name": null,
  "user_account": "NETWORK SERVICE",
  "event_code": null,
  "file_path": null,
  "registry_key": null,
  "command_line_args": null,
  "dns_query": null,
  "http_url": null,
  "http_method": null,
  "bytes_sent": null,
  "bytes_received": null,
  "mitre_technique_hint": null
}