{
  "log_uuid": "fe96863c-0b0c-477c-9b09-70de456010af",
  "ingestion_timestamp": "2026-05-08T09:56:07.030980+00:00",
  "event_timestamp": "2026-05-08T09:56:07.030980+00:00",
  "event_type": "DNS_QUERY",
  "hostname": "WORKSTATION07",
  "sha256_hash": "d53f8df033f4fc94c9de3d225bc019501b38603dd92aac4663f567ffc38000f4",
  "raw_payload": "Baseline log 135",
  "synthetic_intent": "WORKSTATION07 (unknown) queried DNS for unknown.",
  "source_ip": null,
  "dest_ip": null,
  "source_port": null,
  "dest_port": null,
  "process_name": null,
  "parent_process_name": null,
  "user_account": "dprince",
  "event_code": null,
  "file_path": null,
  "registry_key": null,
  "command_line_args": null,
  "dns_query": null,
  "http_url": null,
  "http_method": null,
  "bytes_sent": null,
  "bytes_received": null,
  "mitre_technique_hint": null
}