{
  "log_uuid": "f88d294a-2aad-4cc8-b53c-47d1fe7a5670",
  "ingestion_timestamp": "2026-05-08T09:51:53.242467+00:00",
  "event_timestamp": "2026-05-08T09:51:53.242467+00:00",
  "event_type": "PROCESS_CREATION",
  "hostname": "FILESERVER01",
  "sha256_hash": "25d8e85ccbaf57ae68c04d6239cd2f839405f5aa290bc0ddcadab5b5ccc901d8",
  "raw_payload": "Baseline log 11",
  "synthetic_intent": "User NETWORK SERVICE executed unknown (spawned by unknown) on FILESERVER01.",
  "source_ip": null,
  "dest_ip": null,
  "source_port": null,
  "dest_port": null,
  "process_name": null,
  "parent_process_name": null,
  "user_account": "NETWORK SERVICE",
  "event_code": null,
  "file_path": null,
  "registry_key": null,
  "command_line_args": null,
  "dns_query": null,
  "http_url": null,
  "http_method": null,
  "bytes_sent": null,
  "bytes_received": null,
  "mitre_technique_hint": null
}