{
  "log_uuid": "3d223f99-6c9c-4660-8fe0-6cf9047856a0",
  "ingestion_timestamp": "2026-05-08T09:52:46.517027+00:00",
  "event_timestamp": "2026-05-08T09:52:46.517027+00:00",
  "event_type": "NETWORK_CONNECTION",
  "hostname": "WORKSTATION08",
  "sha256_hash": "27dd1fc02d95fd53761e0af84df2d3d8c910d2add92406d5ab65bf495cf3c86f",
  "raw_payload": "Baseline log 37",
  "synthetic_intent": "unknown on WORKSTATION08 initiated a network connection from unknown:unknown to unknown:unknown.",
  "source_ip": null,
  "dest_ip": null,
  "source_port": null,
  "dest_port": null,
  "process_name": null,
  "parent_process_name": null,
  "user_account": "jsmith",
  "event_code": null,
  "file_path": null,
  "registry_key": null,
  "command_line_args": null,
  "dns_query": null,
  "http_url": null,
  "http_method": null,
  "bytes_sent": null,
  "bytes_received": null,
  "mitre_technique_hint": null
}